{
  "$schema": "./engineering-maturity-rubric.schema.json",
  "schema_version": "1.0",
  "target_score": 95,
  "hard_gate_cap": 90,
  "control_weight": 5,
  "dimensions": {
    "prompt": [
      {"id": "P01", "control": "Machine contracts cover every catalog skill exactly once", "evidence_class": "S", "hard_gate": true},
      {"id": "P02", "control": "Every machine contract conforms to a closed strict schema", "evidence_class": "S", "hard_gate": false},
      {"id": "P03", "control": "Contracts bind current SKILL.md bytes by SHA-256", "evidence_class": "S", "hard_gate": false},
      {"id": "P04", "control": "Contracts bind current catalog identity, version, discipline, and phase", "evidence_class": "S", "hard_gate": false},
      {"id": "P05", "control": "Trigger semantics are machine-readable and source-derived", "evidence_class": "S", "hard_gate": false},
      {"id": "P06", "control": "Scope boundaries and exclusions are machine-readable and source-derived", "evidence_class": "S", "hard_gate": false},
      {"id": "P07", "control": "Required and optional inputs are represented without invented defaults", "evidence_class": "S", "hard_gate": false},
      {"id": "P08", "control": "Outputs and artifact expectations are machine-readable", "evidence_class": "S", "hard_gate": false},
      {"id": "P09", "control": "Read dependencies are machine-readable and provenance-bearing", "evidence_class": "S", "hard_gate": false},
      {"id": "P10", "control": "Writes, side effects, and permission posture are machine-readable", "evidence_class": "S", "hard_gate": false},
      {"id": "P11", "control": "Completion and blocking conditions are machine-readable", "evidence_class": "S", "hard_gate": false},
      {"id": "P12", "control": "Handoff targets and conditions are machine-readable", "evidence_class": "S", "hard_gate": false},
      {"id": "P13", "control": "Extraction uncertainty is explicit and cannot silently fabricate semantics", "evidence_class": "D", "hard_gate": false},
      {"id": "P14", "control": "Contract generation is deterministic across repeated runs", "evidence_class": "D", "hard_gate": false},
      {"id": "P15", "control": "Committed contract artifacts have a fail-closed drift check", "evidence_class": "D", "hard_gate": true},
      {"id": "P16", "control": "Contract generation and regression tests are mandatory in CI", "evidence_class": "O", "hard_gate": false},
      {"id": "P17", "control": "The supported controller consumes the selected machine contract", "evidence_class": "E", "hard_gate": true},
      {"id": "P18", "control": "Semantic requests consume bounded current machine/runtime/router context without leaking assertions", "evidence_class": "D", "hard_gate": false},
      {"id": "P19", "control": "A current complete protocol-v2 real-provider smoke run passes", "evidence_class": "R", "hard_gate": true},
      {"id": "P20", "control": "The real-provider smoke run uses a distinct judge model", "evidence_class": "R", "hard_gate": false}
    ],
    "context": [
      {"id": "C01", "control": "First-party context planning covers every catalog skill", "evidence_class": "S", "hard_gate": true},
      {"id": "C02", "control": "Candidate enumeration is repository-owned rather than host-search dependent", "evidence_class": "S", "hard_gate": true},
      {"id": "C03", "control": "Every plan includes the target skill and required runtime sources", "evidence_class": "S", "hard_gate": false},
      {"id": "C04", "control": "Project memory candidates are explicit and optional when absent", "evidence_class": "S", "hard_gate": false},
      {"id": "C05", "control": "Every candidate carries an explicit authority class", "evidence_class": "S", "hard_gate": false},
      {"id": "C06", "control": "Every candidate carries explicit freshness evidence and policy", "evidence_class": "S", "hard_gate": false},
      {"id": "C07", "control": "Sensitivity limits are explicit and resolver-enforced", "evidence_class": "D", "hard_gate": false},
      {"id": "C08", "control": "Token intent maps to a declared deterministic byte budget", "evidence_class": "S", "hard_gate": false},
      {"id": "C09", "control": "Stable bundle candidates are hash-pinned", "evidence_class": "S", "hard_gate": false},
      {"id": "C10", "control": "Plans bind planner, contract index, contract, and catalog provenance", "evidence_class": "S", "hard_gate": false},
      {"id": "C11", "control": "Planned requests conform to a closed schema", "evidence_class": "D", "hard_gate": false},
      {"id": "C12", "control": "The resolver validates planner-derived budgets and provenance", "evidence_class": "D", "hard_gate": false},
      {"id": "C13", "control": "Missing or changed required context fails closed", "evidence_class": "D", "hard_gate": true},
      {"id": "C14", "control": "Conflicts, supersession, and duplicate content are deterministic", "evidence_class": "D", "hard_gate": false},
      {"id": "C15", "control": "Budget omissions are typed while required overflow fails closed", "evidence_class": "D", "hard_gate": false},
      {"id": "C16", "control": "Context filesystem reads reject links, special files, and swaps", "evidence_class": "D", "hard_gate": false},
      {"id": "C17", "control": "Candidate order cannot change the resolved context signature", "evidence_class": "D", "hard_gate": false},
      {"id": "C18", "control": "The supported path executes route to plan to resolve to snapshot", "evidence_class": "E", "hard_gate": true},
      {"id": "C19", "control": "A manifest can be replayed and live-verified against current sources", "evidence_class": "D", "hard_gate": false},
      {"id": "C20", "control": "Planner, resolver, and end-to-end adversarial tests are mandatory in CI", "evidence_class": "O", "hard_gate": false}
    ],
    "harness": [
      {"id": "H01", "control": "A supported controller CLI owns the complete run lifecycle", "evidence_class": "E", "hard_gate": true},
      {"id": "H02", "control": "Controller runs start with a typed initial route event", "evidence_class": "E", "hard_gate": false},
      {"id": "H03", "control": "Controller turns install and bind immutable context snapshots", "evidence_class": "E", "hard_gate": false},
      {"id": "H04", "control": "Controller checkpoints create verified save points", "evidence_class": "E", "hard_gate": false},
      {"id": "H05", "control": "Success, wait, failure, and abort produce typed envelopes", "evidence_class": "E", "hard_gate": false},
      {"id": "H06", "control": "Runs resume from verified state without trusting projections", "evidence_class": "D", "hard_gate": true},
      {"id": "H07", "control": "Lifecycle retries are idempotent and detect conflicting replay", "evidence_class": "D", "hard_gate": false},
      {"id": "H08", "control": "Snapshots bind an explicit permission and sandbox profile", "evidence_class": "D", "hard_gate": false},
      {"id": "H09", "control": "Successful envelopes reject unfinished tool calls", "evidence_class": "D", "hard_gate": false},
      {"id": "H10", "control": "Operational events are hash-chained and selected-ancestry safe", "evidence_class": "D", "hard_gate": false},
      {"id": "H11", "control": "Standalone and missing-runtime degradation is explicit and fail-closed", "evidence_class": "O", "hard_gate": false},
      {"id": "H12", "control": "Run summaries expose bounded status, route, loop, and evidence metrics", "evidence_class": "O", "hard_gate": false},
      {"id": "H13", "control": "All registered deterministic behavior suites pass", "evidence_class": "D", "hard_gate": false},
      {"id": "H14", "control": "Controller and hardening tests are mandatory in CI", "evidence_class": "O", "hard_gate": false},
      {"id": "H15", "control": "Distribution input rejects links, special files, and multi-link files", "evidence_class": "D", "hard_gate": true},
      {"id": "H16", "control": "Distribution output carries a verified per-file digest manifest", "evidence_class": "D", "hard_gate": false},
      {"id": "H17", "control": "Every live publisher consumes one clean pushed repository+commit identity, pins its bytes, rejects origin/rewrite drift, and binds orchestrated children to that same identity", "evidence_class": "O", "hard_gate": true},
      {"id": "H18", "control": "Registry publish resume state is private, scoped, locked, and atomic", "evidence_class": "O", "hard_gate": false},
      {"id": "H19", "control": "Semantic evidence uses a current-source-verified isolated staged adapter, hard-bounded judge recovery, and a hash-bound ordered attempt ledger", "evidence_class": "D", "hard_gate": true},
      {"id": "H20", "control": "Release readiness requires current complete real-provider evidence from the isolated staged adapter", "evidence_class": "R", "hard_gate": true}
    ],
    "loop": [
      {"id": "L01", "control": "Generic workflow loop state and policy use closed typed schemas", "evidence_class": "S", "hard_gate": true},
      {"id": "L02", "control": "Each loop binds an objective and hypothesis before action", "evidence_class": "S", "hard_gate": false},
      {"id": "L03", "control": "Action, verification, decision, and memory proposal are distinct stages", "evidence_class": "S", "hard_gate": true},
      {"id": "L04", "control": "Loop transitions are explicit and illegal transitions fail closed", "evidence_class": "D", "hard_gate": false},
      {"id": "L05", "control": "Every loop has a hard cycle cap", "evidence_class": "D", "hard_gate": true},
      {"id": "L06", "control": "Every loop has an absolute deadline", "evidence_class": "D", "hard_gate": false},
      {"id": "L07", "control": "Every loop has explicit action or cost budgets", "evidence_class": "D", "hard_gate": false},
      {"id": "L08", "control": "Retry policy is bounded and separate from cycle policy", "evidence_class": "D", "hard_gate": false},